Question N°,Categorie,Questions,Réponse A,Réponse B,Réponse C,Réponse D,Réponse E,Réponse correcte,Photo / schéma technique,
210,7 - Moteur - Traitement des gaz d'échappement,Quelle est la fonction du capteur de pression différentielle?,Mesurer la masse de suie dans le FAP,Mesurer le débit de particules dans le FAP,Mesurer la différence de pression des Gaz dans le FAP,mesurer la quantité de suie dans le FAP ,,C,,
211,7 - Moteur - Traitement des gaz d'échappement,Quelle est la fonction du CCA?,,,,,,"Nitrogen oxides can be reduced with ammonia 
To this end, the system injects AdBlue upstream of the SCR catalytic converter ",,
212,7 - Moteur - Traitement des gaz d'échappement,Quelle est la fonction du CCV sur un système Denoxtronic ?,elle sert e renvoyer l'AdBlue dans son réservoir,elle sert à refroidir l'injecteur d'Adblue ,elles sert a pulvérisée l'adblue ,,,B,,
213,7 - Moteur - Traitement des gaz d'échappement,Quelle est la Pression du circuit d'injection d'adBlue sur un système Denoxtronic 2.2,4.5 Bars,5.5 Bars,9 Bars,,,C,,
214,7 - Moteur - Traitement des gaz d'échappement,Quelle est la pression du système d'injection d'adBlue sur un système Denoxtronic 2.2?,4.5 Bars,5.5 Bars,9 Bars,,,C,,
215,7 - Moteur - Traitement des gaz d'échappement,Quelle est la valeur moyenne de consommation d'AdBlue en rapport a celle du carburant ?,2 à 3% ,3 à 4%,5 à 6 %,7 à 8 %,9 à 10 %,D,,
216,7 - Moteur - Traitement des gaz d'échappement,Quelle est Le dosage moyen d’AdBlue par rapport à la consommation de carburant ?,    de 1 à 3 %,de    3 à 5 % ,de  6 à 8 % ,,,C,,
217,7 - Moteur - Traitement des gaz d'échappement,Quelle est le dosage moyen d'AdBlue en % par rapport à la consommation de carburant?,   from 1 to 3 %,from 3 to 5 % ,from  6 to 8 % ,,,C,,
218,7 - Moteur - Traitement des gaz d'échappement,Quelle tâche un Oxi-Cat ne prend-il pas en charge?,brûleur catalytique,Réduction des Nox,Réduction de la masse des particules,,,,,
219,7 - Moteur - Traitement des gaz d'échappement,Quelles sont les deux parties les plus importantes du système SCR?,,,,,,"Nitrogen oxides can be reduced with ammonia 
To this end, the system injects AdBlue upstream of the SCR catalytic converter ",,
220,7 - Moteur - Traitement des gaz d'échappement,Quels polluants sont traités par le catalyseur sur les moteurs industriels ?,"CO, HC, NOx et CO²","  CO, HC et NOx", CO et HC,,,C,,
221,7 - Moteur - Traitement des gaz d'échappement,Quels polluants sont traités par le catalyseur sur les moteurs industriels?,Le post-catalyseur et le système de dosage ? ,Le convertisseur catalytique et le système de dosage ,Le module de mesure et le pré-catalyseur ,,,B,,
222,7 - Moteur - Traitement des gaz d'échappement,"Quels sont les moyens requis pour le diagnostic du DENOX sur le véhicule?
Camion KTS, boîtier de diagnostic, réfractomètre ",Il est nécessaire de faire 5 cycles de test de dosage d'affilée,avec le système Display,avec une sone Lambda,avec un voltemètre,avec une sonde de température,B,,
223,7 - Moteur - Traitement des gaz d'échappement,Quels sont les processus d'injection?,A une température extérieure inférieure à -5°C,A une température extérieure inférieure à -10°C,A une température extérieure inférieure à -20°C,,,B,,
224,7 - Moteur - Traitement des gaz d'échappement,Quels systèmes de post-traitement des gaz d'échappement sont utilisés dans les véhicules industriels diesel?,,,,,,"DOC (diesel oxidation catalytic converter) 
DPF (particulate filter)
SCR (selective catalytic reduction system) - System with Denoxtronic 
ASC (ammoniacal slip catalytic converter or otherwise: CUC = Clean Up Catalyst)",,
225,7 - Moteur - Traitement des gaz d'échappement,Quels systèmes de traitement des gaz d’échappement sont montés sur les moteur diesels des véhicules industriels ?,Convertisseur catalytique à oxydation / Convertisseur catalytique SCR / Filtre à Particules, Vanne EGR / Filtre à Particules,Convertisseur catalytique à oxydation / vanne EGR,,,A,,
226,7 - Moteur - Traitement des gaz d'échappement,Quels systèmes de traitement des gaz d'échappement sont installés sur les moteurs diesel des véhicules industriels?,Oxidation catalytic converter / SCR catalytic converter / Particulate filter, EGR Valve / Particulate Filter, Oxidation catalytic converter / EGR valve,,,A,,
227,7 - Moteur - Traitement des gaz d'échappement,Quele est la fonction du VCC? ,,,,,,,,
228,8 - Transmission,Dans quelles valeurs la course d'approche du GS est-elle mesurée? (AS-Tronic),en Ink.,en mm,en cm,en Dixieme de mm,en pouce,A,,
229,8 - Transmission,Différence entre la transmission OD et DD,Le poids des variantes de boîte de vitesses est différent,Autres rapports de démultiplication,OD = la vitesse d'entrée est inférieure à la vitesse de sortie,DD = la vitesse d'entrée est inférieure à la vitesse de sortie,,B + C,,
230,8 - Transmission,Où puis-je trouver la liste de contrôle pour la transmission Traxon?,Portail  web Alltrucks,Dossier Gds 3000,intégré dans le Testman et rempli électroniquement (eChecklist),Aucune liste de contrôle n'est disponible sous aucune forme,,C,,
231,8 - Transmission,Puis-je donner une impression de la liste des lubrifiants au client ?,"Non, il est mis à jour tous les trois mois","Oui, fortement recommandé","Oui, si le client le souhaite",pas souhaité car mise a jour ,je ne sais pas,A,,
232,8 - Transmission,Quelle est la pression de travail maximale du ConAct? (TraXon),11 bar,20 bar,"7,5 bar","13,5 bar","5,6 bar",D,,
233,8 - Transmission,"Quelle est la taille du programme de GS 3.0, 3.3 et 3.6 (AS-Tronic)","GS3.0 1513 KB, GS 3.3 3672 KB, GS 3.6 4500 KB",all are almost the same size,"GS3.0 1513 KB, GS 3.0 and 3.6 2672 KB",,,C,,
234,8 - Transmission,Quelle procédure dans le Testman doit être effectué après l'installation d'un nouvel embrayage sur boite de vitesse type TraXon?,"Adaptation accélérée de l'embrayage, point d'auto-adaptation",Tester la pression de pompe,Tester le comportement des groupes,Embrayage usagé installé,"Point de fermeture de l'embrayage à entrée manuelle, étalonnage du capteur d'inclinaison",A ,,
235,8 - Transmission,Quels systèmes de commande de débrayage connaissez vous ?,Convertisseur de couple,Système tiré,Système poussé,Système articulé,système a bascule,B + C,,
236,8 - Transmission,Une purge d'embrayage manuelle est-elle possible (TraXon),Oui et cela ne peut être fait que manuellement,"Oui, mais uniquement dans les cas d'urgence.Les saignements normaux doivent être exécutés via le testman ZF",Non ce n'est pas possible,"oui, mais n'effectuez en aucun cas cette action",,B,,
